The Russian River Pub Forestville California yelp,https://www.yelp.com/biz/russian-river-pub-forestville
Fab Hot Dogs Reseda California yelp,https://www.yelp.com/biz/fab-hot-dogs-reseda-4
Lone Star Taco Bar Allston Massachusetts yelp,https://www.yelp.com/biz/lone-star-taco-bar-allston
A Taste of Home Cooking Wheat Ridge Colorado yelp,https://www.yelp.com/biz/a-taste-of-home-cooking-wheat-ridge
Tin Roof Grill Sandy Utah yelp,https://www.yelp.com/biz/tin-roof-grill-sandy
DMK Burger Bar Chicago Illinois yelp,https://www.yelp.com/biz/dmk-burger-bar-chicago
Pies 'N' Thighs Brooklyn New York yelp,https://www.yelp.com/biz/pies-n-thighs-brooklyn
Cabo Fish Taco Charlotte North Carolina yelp,https://www.yelp.com/biz/cabo-fish-taco-charlotte
Mama Cozza\xe4\xf3\xbbs Anaheim California yelp,No URL Found
The Rivershack Tavern Jefferson Louisiana yelp,https://www.yelp.com/biz/rivershack-tavern-jefferson
Slim\xe4\xf3\xbbs Last Chance Chili Shack & Watering Hole Seattle Washington yelp,No URL Found
Jefferson Diner Lake Hopatcong New Jersey yelp,https://www.yelp.com/biz/jefferson-diner-lake-hopatcong
The Grilled Cheeserie Nashville Tennessee yelp,https://www.yelp.com/biz/the-grilled-cheeserie-nashville
Blackwater Grill St. Simons Island Georgia yelp,https://www.yelp.com/biz/blackwater-grill-saint-simons-island-3
Crepe Expectations Las Vegas Nevada yelp,https://www.yelp.com/biz/cr%25C3%25AApe-expectations-las-vegas-2
Driftwood Publick House & Oysteria Plymouth Massachusetts yelp,https://www.yelp.com/biz/driftwood-publick-house-plymouth
Rick's Press Room Grill & Bar Meridian Idaho yelp,https://www.yelp.com/biz/ricks-press-room-grill-and-bar-meridian
Bert\xe4\xf3\xbbs Burger Bowl Santa Fe New Mexico yelp,No URL Found
Green Mesquite Austin Texas yelp,https://www.yelp.com/biz/green-mesquite-bbq-and-more-austin
Pier 23 Caf\xed\xa9 San Francisco California yelp,https://www.yelp.com/biz/pier-23-cafe-san-francisco
Tune-Up Caf\xed\xa9 Santa Fe New Mexico yelp,https://www.yelp.com/biz/tune-up-cafe-santa-fe
Aunt Lena's Creamery Chandler Arizona yelp,https://www.yelp.com/biz/aunt-lenas-creamery-chandler
Prince Lebanese Grill Arlington Texas yelp,https://www.yelp.com/biz/prince-lebanese-grill-arlington
Pizzeria Luigi North Park California yelp,https://www.yelp.com/biz/pizzeria-luigi-san-diego-2
From Scratch Restaurant Carmel California yelp,https://www.yelp.com/search%3Ffind_desc%3DBest%2BRestaurants%26find_loc%3DCarmel-by-the-Sea%252C%2BCA%2B93923
Mac & Ernie's Tarpley Texas yelp,https://www.yelp.com/biz/mac-and-ernies-roadside-eatery-tarpley-2
Caplansky's Deli Toronto Ontario yelp,https://www.yelp.com/biz/caplanskys-delicatessen-toronto
At Last Cafe Long Beach California yelp,https://www.yelp.com/biz/at-last-cafe-long-beach
Hildebrandt\xe4\xf3\xbbs Williston Park New York yelp,No URL Found
Ruth\xe4\xf3\xbbs Diner Salt Lake City Utah yelp,No URL Found
The Silver Star Caf\xed\xa9 Park City Utah yelp,https://www.yelp.com/biz/silver-star-cafe-park-city
Monterey Fish House Monterey California yelp,https://www.yelp.com/biz/montereys-fish-house-monterey-2
Highland Tavern Denver Colorado yelp,https://www.yelp.com/biz/highland-tavern-denver
Aunt Carrie's Narragansett Rhode Island yelp,https://www.yelp.com/biz/aunt-carries-restaurant-narragansett
Hank\xe4\xf3\xbbs Haute Dogs Honolulu Hawaii yelp,No URL Found
Four Kegs Sports Pub Las Vegas Nevada yelp,https://www.yelp.com/biz/four-kegs-sports-bar-las-vegas
Nic\xe4\xf3\xbbs Grill Oklahoma City Oklahoma yelp,No URL Found
The Front Porch San Francisco California yelp,https://www.yelp.com/biz/the-front-porch-san-francisco
Boulevard Diner Dundalk Maryland yelp,https://www.yelp.com/biz/boulevard-diner-dundalk
Bobby's Hawaiian Style Restaurant Everett Washington yelp,https://www.yelp.com/biz/bobbys-hawaiian-style-restaurant-lynnwood-3
Gannucci\xe4\xf3\xbbs Italian Market Duluth Minnesota yelp,No URL Found
The Joint New Orleans Louisiana yelp,https://www.yelp.com/biz/the-joint-new-orleans
Shucker's World Famous Raw Bar Woods Hole Massachusetts yelp,https://www.yelp.com/biz/shuckers-woods-hole
Empire Brewing Company Syracuse New York yelp,https://www.yelp.com/biz/empire-brewing-company-syracuse-2
Cornbread Cafe Eugene Oregon yelp,https://www.yelp.com/biz/cornbread-cafe-eugene
39th Street Mama's Kansas City Missouri yelp,https://www.yelp.com/biz/mamas-39th-st-diner-kansas-city
Black Pelican Oceanfront Restaurant Kitty Hawk North Carolina yelp,https://www.yelp.com/biz/black-pelican-kitty-hawk
Valencia Luncheria Norwalk Connecticut yelp,https://www.yelp.com/biz/valencia-luncheria-norwalk
Tiki Bar Cabo San Lucas Mexico yelp,https://www.yelp.com/biz/tiki-bar-cabo-san-lucas
Hill\xe4\xf3\xbbs Restaurant & Lounge Spokane Washington yelp,No URL Found
Fox Bros Bar-B-Q Atlanta Georgia yelp,https://www.yelp.com/biz/fox-bros-bar-b-q-atlanta
Panozzo's Italian Market Chicago Illinois yelp,https://www.yelp.com/biz/panozzos-italian-market-chicago
The Kitchen Oxnard California yelp,https://www.yelp.com/biz/the-kitchen-oxnard
Emily\xe4\xf3\xbbs Lebanese Deli Minneapolis Minnesota yelp,No URL Found
Wallace Station Versailles Kentucky yelp,https://www.yelp.com/biz/wallace-station-deli-and-bakery-versailles
Blueplate Lunch Counter & Soda Fountain Portland Oregon yelp,https://www.yelp.com/biz/blueplate-portland
Keegan's Seafood Grille Indian Rocks Beach Florida yelp,https://www.yelp.com/biz/keegans-seafood-grille-indian-rocks-beach
Casa Razdora Boston Massachusetts yelp,https://www.yelp.com/biz/casa-razdora-boston
Queen's Comfort Astoria New York yelp,https://www.yelp.com/biz/queens-comfort-astoria
Manci's Antique Club Daphne Alabama yelp,https://www.yelp.com/biz/mancis-antique-club-daphne-2
Bay Way Diner Linden New Jersey yelp,https://www.yelp.com/biz/bayway-diner-linden
La Pines Caf\xed\xa9 Slidell Louisiana yelp,https://www.yelp.com/biz/la-pines-cafe-slidell
Surrey\xe4\xf3\xbbs Caf\xed\xa9 New Orleans Louisiana yelp,No URL Found
Dj\xe4\xf3\xbbs Clam Shack Key West Florida yelp,No URL Found
Sabroso Mexican Grill Garden Grove California yelp,https://www.yelp.com/biz/sabroso-mexican-grill-garden-grove
Paul\xe4\xf3\xbbs Live From New York Eureka California yelp,No URL Found
Big Jim\xe4\xf3\xbbs Pittsburgh Pennsylvania yelp,https://www.yelp.com/biz/big-jims-restaurant-and-bar-pittsburgh
Krazy Jim's Blimpy Burger Ann Arbor Michigan yelp,https://www.yelp.com/biz/krazy-jims-blimpy-burger-ann-arbor-3
Elk Public House Spokane Washington yelp,https://www.yelp.com/biz/the-elk-public-house-spokane
Maria\xe4\xf3\xbbs Taco Express Austin Texas yelp,No URL Found
Black Tree New York New York yelp,https://www.yelp.com/biz/black-tree-new-york
The Alley Restaurant At Aiea Bowl Aiea Hawaii yelp,https://www.yelp.com/biz/the-alley-restaurant-bar-and-grill-aiea-2
Restaurant 415 Fort Collins Colorado yelp,https://www.yelp.com/biz/restaurant-415-fort-collins
Clendenen\xe4\xf3\xbbs Cider Works Fortuna California yelp,No URL Found
