Scully's Tavern Miami Florida yelp,https://www.yelp.com/biz/scullys-tavern-miami
90 Miles Cuban Cafe Chicago Illinois yelp,https://www.yelp.com/biz/90-miles-cuban-caf%25C3%25A9-chicago-5
Broders' Cucina Italiana Minneapolis Minnesota yelp,https://www.yelp.com/biz/broders-cucina-italiana-minneapolis
El Indio San Diego California yelp,https://www.yelp.com/biz/el-indio-mexican-restaurant-san-diego-3
The Duce Phoenix Arizona yelp,https://www.yelp.com/biz/the-duce-phoenix
Don Antonio By Starita Manhattan New York yelp,https://www.yelp.com/biz/don-antonio-by-starita-new-york-2
Parkview Nightclub Cleveland Ohio yelp,https://www.yelp.com/biz/parkview-nite-club-cleveland
Irazu Chicago Illinois yelp,https://www.yelp.com/biz/irazu-costa-rican-restaurant-chicago-2
Harvey's Hot Dogs II Portsmouth Virginia yelp,https://www.yelp.com/biz/harveys-hot-dogs-portsmouth
Foreign & Domestic Austin Texas yelp,https://www.yelp.com/biz/foreign-and-domestic-austin
11th Street Diner Miami Beach Florida yelp,https://www.yelp.com/biz/11th-street-diner-miami-beach-2
Italian Corner East Providence Rhode Island yelp,https://www.yelp.com/biz/italian-corner-east-providence
Chef Point Caf\xed\xa9 Wautaga Texas yelp,https://www.yelp.com/biz/chef-point-cafe-watauga
Meal Ticket Berkeley California yelp,https://www.yelp.com/biz/meal-ticket-berkeley
The Starling Diner Long Beach California yelp,https://www.yelp.com/biz/starling-diner-long-beach
The Brick Kansas City Missouri yelp,https://www.yelp.com/biz/the-brick-kansas-city
Guerilla Street Food St. Louis Missouri yelp,https://www.yelp.com/biz/guerrilla-street-food-saint-louis
Three Angels Diner Memphis Tennessee yelp,https://www.yelp.com/biz/3-angels-on-broad-memphis-2
Nexus Brewery Albuquerque New Mexico yelp,https://www.yelp.com/biz/nexus-brewery-albuquerque
Forte European Tapas Bar & Bistro Las Vegas Nevada yelp,https://www.yelp.com/biz/forte-european-tapas-bar-and-bistro-las-vegas
Tocabe American Indian Eatery Denver Colorado yelp,https://www.yelp.com/biz/tocabe-american-indian-eatery-denver
Jax At The Trax Truckee California yelp,https://www.yelp.com/biz/jax-truckee-diner-truckee
Hob Nob Hill San Diego California yelp,https://www.yelp.com/biz/hob-nob-hill-san-diego
Anchor Bar Superior Wisconsin yelp,https://www.yelp.com/biz/anchor-bar-superior
Glenn\xe4\xf3\xbbs Diner Chicago Illinois yelp,No URL Found
Whale\xe4\xf3\xbbs Rib Deerfield Beach Florida yelp,No URL Found
Bryant-Lake Bowl Minneapolis Minnesota yelp,https://www.yelp.com/biz/bryant-lake-bowl-minneapolis-2
Fat Choy Las Vegas Nevada yelp,https://www.yelp.com/biz/fat-choy-las-vegas
Maria's Taco Express Austin Texas yelp,https://www.yelp.com/biz/marias-tacos-xpress-austin
Joe's Cable Car San Francisco California yelp,https://www.yelp.com/biz/joes-cable-car-restaurant-san-francisco
Arnold\xe4\xf3\xbbs Country Kitchen Nashville Tennessee yelp,No URL Found
Louis Restaurant Providence Rhode Island yelp,https://www.yelp.com/biz/louis-family-restaurant-providence
Tom\xe4\xf3\xbbs Thumb Fresh Market Scottsdale Arizona yelp,No URL Found
The Oinkster Eagle Rock California yelp,https://www.yelp.com/biz/the-oinkster-los-angeles
Naked City Pizza Las Vegas Nevada yelp,https://www.yelp.com/biz/naked-city-pizza-shop-on-arville-las-vegas
Taste of Europe Arlington Texas yelp,https://www.yelp.com/biz/a-taste-of-europe-arlington
Grubstake Diner San Francisco California yelp,https://www.yelp.com/biz/grubstake-san-francisco
Chomp Chomp Nation Irvine California yelp,https://www.yelp.com/biz/chomp-chomp-nation-anaheim-2
Counter Cafe Austin Texas yelp,https://www.yelp.com/biz/counter-cafe-east-austin
Jamaica Kitchen Kendale Lakes Florida yelp,https://www.yelp.com/biz/jamaica-kitchen-miami
Carluccio\xe4\xf3\xbbs Coal Fired Pizza Northfield New Jersey yelp,No URL Found
Tamarindo Truck Orange County California yelp,https://www.yelp.com/biz/tamarindo-truck-orange
Cravings Duck North Carolina yelp,https://www.yelp.com/biz/coastal-cravings-duck
Mad Greek's Diner Baker California yelp,https://www.yelp.com/biz/the-mad-greek-baker
Sidecar Bar and Grille Philadelphia Pennsylvania yelp,https://www.yelp.com/biz/the-sidecar-bar-and-grille-philadelphia
The Dining Car & Market Philadelphia Pennsylvania yelp,https://www.yelp.com/biz/the-dining-car-and-market-philadelphia
Opal Thai Food Haleiwa Hawaii yelp,https://www.yelp.com/biz/opal-thai-food-haleiwa-4
Blow Fly Inn Gulfport Mississippi yelp,https://www.yelp.com/biz/blow-fly-inn-gulfport-2
Espino's Mexican Bar and Grill Chesterfield Missouri yelp,https://www.yelp.com/biz/espinos-mexican-bar-and-grill-chesterfield
South Of Beale (SOB) Memphis Tennessee yelp,https://www.yelp.com/biz/south-of-beale-memphis
Clanton's Caf\xed\xa9 Vinita Oklahoma yelp,No URL Found
Tap Tap Haitian Restaurant Miami Beach Florida yelp,https://www.yelp.com/biz/tap-tap-restaurant-miami-beach-2
Salsa Brava Flagstaff Arizona yelp,https://www.yelp.com/biz/salsa-brava-flagstaff
Tattooed Moose Charleston South Carolina yelp,https://www.yelp.com/biz/tattooed-moose-charleston
Dixie Supply Bakery & Cafe Charleston South Carolina yelp,https://www.yelp.com/biz/dixie-supply-bakery-and-cafe-charleston
Donatelli's White Bear Lake Minnesota yelp,https://www.yelp.com/biz/donatellis-white-bear-lake
Kramarczuk Sausage Company Minneapolis Minnesota yelp,https://www.yelp.com/biz/kramarczuks-sausage-company-minneapolis
Pizzalchik Boise Idaho yelp,https://www.yelp.com/biz/pizzalchik-boise
Los Tapatios San Jose California yelp,https://www.yelp.com/biz/los-tapatios-taco-truck-san-jose
Grover\xe4\xf3\xbbs Bar & Grill East Amherst New York yelp,No URL Found
Clanton's Cafe Vinita Oklahoma yelp,https://www.yelp.com/biz/clantons-cafe-vinita
Triple XXX Restaurant West Lafayette Indiana yelp,https://www.yelp.com/biz/triple-xxx-restaurant-west-lafayette
Crockett's Public House Puyallup Washington yelp,https://www.yelp.com/biz/crocketts-public-house-puyallup
Pine State Biscuits Portland Oregon yelp,https://www.yelp.com/biz/pine-state-biscuits-portland-2
Magnolia Caf\xed\xa9 Austin Texas yelp,https://www.yelp.com/biz/magnolia-cafe-austin-2
Badboy Burrito Key West Florida yelp,https://www.yelp.com/biz/bad-boy-burrito-key-west
Iron Barley St. Louis Missouri yelp,https://www.yelp.com/biz/iron-barley-eating-establishment-saint-louis
Bunk Sandwiches Portland Oregon yelp,https://www.yelp.com/biz/bunk-sandwiches-portland-5
Rosie's Diner Rockford Michigan yelp,https://www.yelp.com/biz/rosies-diner-rockford
Gloria\xe4\xf3\xbbs Caf\xed\xa9 Los Angeles California yelp,No URL Found
Pete's Breakfast House Ventura California yelp,https://www.yelp.com/biz/petes-breakfast-house-restaurant-ventura
Matt\xe4\xf3\xbbs Big Breakfast Phoenix Arizona yelp,No URL Found
Ramona Cafe Ramona California yelp,https://www.yelp.com/biz/ramona-cafe-ramona-2
John's of 12th Street Manhattan New York yelp,https://www.yelp.com/biz/johns-of-12th-street-new-york-2
Pinky G\xe4\xf3\xbbs Pizzeria Jackson Wyoming yelp,No URL Found
La Cucina Del Garga Firenze Italy yelp,https://www.yelp.com/biz/la-cucina-del-garga-firenze
Dish Charlotte North Carolina yelp,https://www.yelp.com/biz/dish-charlotte
Brick Oven Pizza Baltimore Maryland yelp,https://www.yelp.com/biz/brick-oven-pizza-baltimore
Patti's Pierogis Fall River Massachusetts yelp,https://www.yelp.com/biz/pattis-pierogis-fall-river
Asi y Asado Cabo San Lucas Mexico yelp,https://www.yelp.com/biz/as%25C3%25AD-y-asado-cabo-san-lucas-2
Capone\xe4\xf3\xbbs Pub Coeur d\xe4\xf3\xbbAlene Idaho yelp,No URL Found
Standard Tap Philadelphia Pennsylvania yelp,https://www.yelp.com/biz/standard-tap-philadelphia
Evelyn's Drive-In Tiverton Rhode Island yelp,https://www.yelp.com/biz/evelyns-drive-in-tiverton
Supino Pizzeria Detroit Michigan yelp,https://www.yelp.com/biz/supino-pizzeria-detroit
Bachi Burger Las Vegas Nevada yelp,https://www.yelp.com/biz/bachi-burger-las-vegas
Bang! Denver Colorado yelp,https://www.yelp.com/biz/bang-denver
HRD Coffee Shop San Francisco California yelp,https://www.yelp.com/biz/hrd-san-francisco-4
Chicago Brauhaus Chicago Illinois yelp,https://www.yelp.com/biz/chicago-brauhaus-chicago
Wild Plum Cafe & Bistro Monterey California yelp,https://www.yelp.com/biz/the-wild-plum-cafe-and-bakery-monterey
Bruno's European Restaurant Tacoma Washington yelp,https://www.yelp.com/biz/brunos-european-restaurant-lakewood
The Weeping Radish Jarvisburg North Carolina yelp,https://www.yelp.com/biz/weeping-radish-farm-brewery-grandy
Kounty Quarthouse South Range Wisconsin yelp,https://www.yelp.com/biz/kounty-quarthouse-south-range
The Silver Skillet Atlanta Georgia yelp,https://www.yelp.com/biz/the-silver-skillet-atlanta
Danny Edward's BBQ Kansas City Missouri yelp,https://www.yelp.com/biz/danny-edwards-boulevard-bbq-kansas-city
George The Chili King Drive-In Des Moines Iowa yelp,https://www.yelp.com/biz/george-the-chili-king-des-moines-2
Chino Bandido Phoenix Arizona yelp,https://www.yelp.com/biz/chino-bandido-phoenix-3
Funk N Waffles Syracuse New York yelp,https://www.yelp.com/biz/funk-n-waffles-syracuse
Sam LaGrassa's Boston Massachusetts yelp,https://www.yelp.com/biz/sam-lagrassas-boston-3
Sakaya Kitchen Miami Florida yelp,https://www.yelp.com/biz/sakaya-kitchen-miami
Oohh\xe4\xf3\xbbs & Aahh\xe4\xf3\xbbs Gourmet Deli Washington D.C. yelp,No URL Found
Donnie Mac\xe4\xf3\xbbs Trailer Park Cuisine Boise Idaho yelp,No URL Found
The Pit Stop Merrick New York yelp,https://www.yelp.com/biz/the-pit-stop-merrick
Casa Chimayo Restaurant Santa Fe New Mexico yelp,https://www.yelp.com/biz/casa-chimayo-restaurant-santa-fe
Pig Latin (Food Truck) Colorado Springs Colorado yelp,https://www.yelp.com/biz/piglatin-truck-colorado-springs
Scully's Tavern Miami FL yelp,https://www.yelp.com/biz/scullys-tavern-miami
"Arleta Library, Bakery & Caf\xed\xa9 Portland Oregon yelp",https://www.yelp.com/biz/arleta-library-bakery-cafe-portland
The Park's Finest BBQ Los Angeles California yelp,https://www.yelp.com/biz/the-parks-finest-los-angeles
Polka Restaurant & Catering Los Angeles California yelp,https://www.yelp.com/biz/polka-polish-restaurant-los-angeles-2
Indy\xe4\xf3\xbbs Historic Steer-In Restaurant Indianapolis Indiana yelp,https://www.yelp.com/biz/indys-historic-steer-in-restaurant-indianapolis-2
Comet Ping Pong Washington D.C. yelp,https://www.yelp.com/biz/comet-ping-pong-washington
Brint's Diner Wichita Kansas yelp,https://www.yelp.com/biz/brints-diner-wichita-5
Parasol\xe4\xf3\xbbs New Orleans Louisiana yelp,No URL Found
Wilson\xe4\xf3\xbbs Holy Smoke BBQ Fairfield Connecticut yelp,No URL Found
Jimmy\xe4\xf3\xbbs Famous Seafood Baltimore Maryland yelp,https://www.yelp.com/biz/jimmys-famous-seafood-baltimore
Taco Bus Tampa Florida yelp,https://www.yelp.com/biz/taco-bus-tampa-8
Get Fresh Caf\xed\xa9 Norfolk Virginia yelp,https://www.yelp.com/biz/get-fresh-cafe-norfolk
Central City Cafe Huntington West Virginia yelp,https://www.yelp.com/biz/central-city-cafe-huntington
Brindle Room New York New York yelp,https://www.yelp.com/biz/brindle-room-new-york
Fat Sal\xe4\xf3\xbbs Deli Los Angeles California yelp,No URL Found
Mambos Caf\xed\xa9 Glendale California yelp,No URL Found
Chaps Pit Beef Baltimore Maryland yelp,https://www.yelp.com/biz/chaps-pit-beef-baltimore
Rainbow Drive-In Honolulu Hawaii yelp,https://www.yelp.com/biz/rainbow-drive-in-honolulu
Garbo\xe4\xf3\xbbs Grill Key West Florida yelp,No URL Found
Bludso's BBQ Compton California yelp,https://www.yelp.com/biz/bludsos-bbq-compton
Emily\xe4\xf3\xbbs Lebanese Delicatessen Minneapolis Minnesota yelp,https://www.yelp.com/biz/emilys-lebanese-delicatessen-minneapolis
Hook Camden Town Camden London UK yelp,https://www.yelp.com/search%3Ffind_desc%3Dhook%2Bcamden%2Btown%26find_loc%3DLondon
Starlite Lounge Blawnox Pennsylvania yelp,https://www.yelp.com/biz/starlite-lounge-pittsburgh
Artiso's Salt Lake City Utah yelp,https://www.yelp.com/biz/aristos-greek-restaurant-and-cafe-salt-lake-city-2
South 21 Drive-In Charlotte North Carolina yelp,https://www.yelp.com/biz/south-21-drive-in-charlotte-2
Chop House Burgers Arlington Texas yelp,https://www.yelp.com/biz/chop-house-burgers-arlington-3
Delta Diner Delta Wisconsin yelp,https://www.yelp.com/biz/delta-diner-delta
Rocco\xe4\xf3\xbbs Caf\xed\xa9 San Francisco California yelp,No URL Found
South 21 Drive In Charlotte North Carolina yelp,https://www.yelp.com/biz/south-21-drive-in-charlotte-2
Mama's Food Shop Manhattan New York yelp,https://www.yelp.com/biz/mamas-food-shop-new-york-2
Kuma\xe4\xf3\xbbs Corner Chicago Illinois yelp,No URL Found
Mahoney\xe4\xf3\xbbs Po-Boy Shop New Orleans Louisiana yelp,No URL Found
10th Ave Burrito Co Belmar New Jersey yelp,https://www.yelp.com/biz/10th-avenue-burrito-co-belmar
O\xe4\xf3\xbbRourke\xe4\xf3\xbbs Diner Middletown Connecticut yelp,No URL Found
Jose\xe4\xf3\xbbs Real Cuban Food Bradenton Florida yelp,No URL Found
At Sara\xe4\xf3\xbbs Table Chester Creek Caf\xed\xa9 Duluth Minnesota yelp,No URL Found
Louie & the Red Head Lady Mandeville Louisiana yelp,https://www.yelp.com/biz/louie-and-the-redhead-lady-mandeville-3
Charlie's Diner Spencer Massachusetts yelp,https://www.yelp.com/biz/charlies-diner-spencer
The Penguin Charlotte North Carolina yelp,https://www.yelp.com/biz/the-penguin-drive-in-charlotte
Burger Me! Truckee California yelp,https://www.yelp.com/biz/burger-me-truckee
Bob\xe4\xf3\xbbs Clam Hut Kittery Maine yelp,No URL Found
Burger Bar Roy Utah yelp,https://www.yelp.com/biz/burger-bar-roy
Senor Sisig Food Truck San Francisco California yelp,https://www.yelp.com/biz/se%25C3%25B1or-sisig-san-francisco-3
Bayport BBQ Bayport Minnesota yelp,https://www.yelp.com/biz/bayport-bbq-bayport
Cattlemen's Steakhouse Oklahoma City Oklahoma yelp,https://www.yelp.com/biz/cattlemens-steak-house-oklahoma-city
Sweetie Pie's St. Louis Missouri yelp,https://www.yelp.com/biz/sweetie-pies-soul-food-saint-louis-2
Percy Street Barbecue Philadelphia Pennsylvania yelp,https://www.yelp.com/biz/percy-street-barbecue-philadelphia
Moochie's Meatballs & More Salt Lake City Utah yelp,https://www.yelp.com/biz/moochies-meatballs-and-more-salt-lake-city
Louie Mueller BBQ Taylor Texas yelp,https://www.yelp.com/biz/louie-mueller-barbecue-taylor
Pepe's and Mito's Dallas Texas yelp,https://www.yelp.com/biz/pepes-and-mitos-mexican-caf%25C3%25A9-dallas-2
Sophia\xe4\xf3\xbbs Place Albuquerque New Mexico yelp,No URL Found
The Anchorage Tavern Somers Point New Jersey yelp,https://www.yelp.com/biz/anchorage-tavern-restaurant-somers-point
CoraFaye's Caf\xed\xa9 Denver Colorado yelp,No URL Found
Blue Ash Chili Restaurant Cincinnati Ohio yelp,https://www.yelp.com/biz/blue-ash-chili-cincinnati
Maxwell\xe4\xf3\xbbs East Coast Eatery Salt Lake City Utah yelp,No URL Found
The Sink Boulder Colorado yelp,https://www.yelp.com/biz/the-sink-boulder
Pica Pica San Francisco California yelp,https://www.yelp.com/biz/pica-pica-arepa-kitchen-san-francisco
El Nuevo Frutilandia San Francisco California yelp,https://www.yelp.com/biz/el-nuevo-frutilandia-san-francisco
Merritt Canteen Inc. Bridgeport Connecticut yelp,https://www.yelp.com/biz/merritt-canteen-bridgeport
Marlowe's Ribs Memphis Tennessee yelp,https://www.yelp.com/biz/marlowes-ribs-and-restaurant-memphis-2
Brine and Bottle Nags Head North Carolina yelp,https://www.yelp.com/biz/the-brine-and-bottle-nags-head
Pizza Junction North Tonawanda New York yelp,https://www.yelp.com/biz/pizza-junction-north-tonawanda
Munch\xe4\xf3\xbbs Restaurant & Sundries St. Petersburg Florida yelp,No URL Found
Johnny Garlic's Santa Rosa California yelp,https://www.yelp.com/biz/johnny-garlics-santa-rosa-6
Tufano\xe4\xf3\xbbs Vernon Park Tap Chicago Illinois yelp,No URL Found
Polish Village Caf\xed\xa9 Hamtramck Michigan yelp,No URL Found
Avila\xe4\xf3\xbbs Caf\xed\xa9 Dallas Texas yelp,No URL Found
Mas Tacos Nashville Tennessee yelp,https://www.yelp.com/biz/mas-tacos-nashville
The Glass Onion Charleston South Carolina yelp,https://www.yelp.com/biz/the-glass-onion-charleston
Brats Brothers Sherman Oaks California yelp,https://www.yelp.com/biz/brats-brothers-sherman-oaks
The Ritz Diner Livingston New Jersey yelp,https://www.yelp.com/biz/ritz-diner-livingston
Grano\xe4\xf3\xbbs Pasta Bar Baltimore Maryland yelp,No URL Found
South Philadelphia Tap Room Philadelphia Pennsylvania yelp,https://www.yelp.com/biz/south-philadelphia-tap-room-philadelphia-3
Lito's Mexican Restaurant Santa Barbara California yelp,https://www.yelp.com/biz/litos-take-out-santa-barbara
Catelli\xe4\xf3\xbbs Geyserville California yelp,No URL Found
BB's Lawnside BBQ Kansas City Missouri yelp,https://www.yelp.com/biz/b-b-s-lawnside-bbq-kansas-city
LoBello\xe4\xf3\xbbs Spaghetti House Coraopolis Pennsylvania yelp,No URL Found
W.O.W. - Worth Our Weight Santa Rosa California yelp,https://www.yelp.com/biz/worth-our-weight-santa-rosa
Tioli's Crazee Burger San Diego California yelp,https://www.yelp.com/biz/crazee-burger-san-diego-3
Smokin Guns BBQ & Catering Kansas City Missouri yelp,https://www.yelp.com/biz/smokin-guns-bbq-and-catering-north-kansas-city
Red Wagon Caf\xed\xa9 Vancouver British Columbia yelp,No URL Found
Monte Carlo Steak House Albuquerque New Mexico yelp,https://www.yelp.com/biz/monte-carlo-steak-house-albuquerque-2
Jimtown Store Healdsburg California yelp,https://www.yelp.com/biz/jimtown-store-healdsburg-2
Leo's BBQ Oklahoma City Oklahoma yelp,https://www.yelp.com/biz/leos-barbeque-oklahoma-city
Voula\xe4\xf3\xbbs Offshore Cafe Seattle Washington yelp,No URL Found
Save On Meats Vancouver British Columbia yelp,https://www.yelp.com/biz/save-on-meats-vancouver
Galewood Cook Shack Chicago Illinois yelp,https://www.yelp.com/search%3Ffind_desc%3Dgalewood%2Bcook%2Bshack%26find_loc%3DChicago%252C%2BIL
Cafe Brazil Denver Colorado yelp,https://www.yelp.com/biz/caf%25C3%25A9-brazil-denver-2
Memphis Barbecue Co. Horn Lake Mississippi yelp,https://www.yelp.com/biz/memphis-barbecue-company-horn-lake-2
Duck\xe4\xf3\xbbs Eatery Manhattan New York yelp,https://www.yelp.com/search%3Fcflt%3Drestaurants%26find_loc%3DNew%2BYork%252C%2BNY
Al\xe4\xf3\xbbs Breakfast Minneapolis Minnesota yelp,https://www.yelp.com/biz/als-breakfast-minneapolis
Zest Indianapolis Indiana yelp,https://www.yelp.com/biz/zest-exciting-food-creations-indianapolis-3
La Taverna dei Miracoli da Mangiafuoco Toscana Italy yelp,https://www.tripadvisor.com/Restaurant_Review-g1016807-d2306252-Reviews-La_Taverna_dei_Miracoli_da_Mangiafuoco-Pescia_Province_of_Pistoia_Tuscany.html
Di Pasquale\xe4\xf3\xbbs Baltimore Maryland yelp,https://www.yelp.com/biz/di-pasquales-italian-marketplace-baltimore
Voula's Offshore Caf\xed\xa9 Seattle Washington yelp,https://www.yelp.com/biz/voulas-offshore-cafe-seattle
The Golden Bear Sacramento California yelp,https://www.yelp.com/biz/the-golden-bear-sacramento
Yankee Lobster Company Boston Massachusetts yelp,https://www.yelp.com/biz/yankee-lobster-boston
Broken Record San Francisco California yelp,https://www.yelp.com/biz/broken-record-san-francisco
Mert's Heart & Soul Charlotte North Carolina yelp,https://www.yelp.com/biz/merts-heart-and-soul-charlotte
The Bagel Delicatessen & Restaurant Denver Colorado yelp,https://www.yelp.com/biz/the-bagel-deli-and-restaurant-denver-3
Otto\xe4\xf3\xbbs Sausage Kitchen & Meat Market Portland Oregon yelp,No URL Found
Sage General Store Queens New York yelp,https://www.yelp.com/biz/sage-roadhouse-long-island-city
Gazala's Place Manhattan New York yelp,https://www.yelp.com/biz/gazalas-new-york-23
Pastabilities Syracuse New York yelp,https://www.yelp.com/biz/pastabilities-syracuse
Steuben\xe4\xf3\xbbs Food Service Denver Colorado yelp,No URL Found
Muertos Kitchen & Lounge Bakersfield California yelp,https://www.yelp.com/biz/muertos-kitchen-and-lounge-bakersfield-2
The Barking Dog Indianapolis Indiana yelp,https://www.yelp.com/biz/barking-dog-cafe-indianapolis
Doumar's Norfolk Virginia yelp,https://www.yelp.com/biz/doumars-cones-and-barbecue-norfolk
Nickel Diner Los Angeles California yelp,https://www.yelp.com/biz/nickel-diner-los-angeles-2
Dell Rhea's Chicken Basket Willowbrook Illinois yelp,https://www.yelp.com/biz/dell-rheas-chicken-basket-willowbrook
Trina\xe4\xf3\xbbs Starlite Lounge Somerville Massachusetts yelp,No URL Found
Quahog\xe4\xf3\xbbs Seafood Shack Stone Harbor New Jersey yelp,No URL Found
Mike\xe4\xf3\xbbs Huli Huli Chicken Kaneohe Hawaii yelp,No URL Found
The Lodge Sasquatch Kitchen Fort Collins Colorado yelp,https://www.yelp.com/biz/the-lodge-sasquatch-kitchen-fort-collins
Zia Diner & Angel Food Catering Santa Fe New Mexico yelp,https://www.yelp.com/biz/zia-diner-santa-fe
Chuck\xe4\xf3\xbbs Southern Comforts Caf\xed\xa9 Burbank Illinois yelp,No URL Found
Virginia Diner Wakefield Virginia yelp,https://www.yelp.com/biz/virginia-diner-wakefield-2
Golden Crown Restaurant Albuquerque New Mexico yelp,https://www.yelp.com/biz/golden-crown-panaderia-albuquerque
Sammy's Food Services & Deli New Orleans Louisiana yelp,https://www.yelp.com/biz/sammys-food-service-and-deli-new-orleans
Bub and Pop's Washington DC yelp,https://www.yelp.com/biz/bub-and-pops-washington
Farmer\xe4\xf3\xbbs Shed Lexington South Carolina yelp,No URL Found
Traffic Jam & Snug Detroit Michigan yelp,https://www.yelp.com/biz/traffic-jam-and-snug-detroit-3
Mo Gridder's BBQ Bronx New York yelp,https://www.yelp.com/biz/mogridders-bbq-bronx
Kenny & Ziggy\xe4\xf3\xbbs Houston Texas yelp,No URL Found
Taco Taco Cafe San Antonio Texas yelp,https://www.yelp.com/biz/taco-taco-cafe-san-antonio
J.J. McBrewster\xe4\xf3\xbbs Lexington Kentucky yelp,No URL Found
Panini Pete's Fairhope Alabama yelp,https://www.yelp.com/biz/panini-petes-fairhope
Tortugas' Lie Nags Head North Carolina yelp,https://www.yelp.com/biz/tortugas-lie-nags-head-2
Bless My Soul Eureka California yelp,https://www.yelp.com/biz/bless-my-soul-cafe-eureka
Greek Corner Restaurant Cambridge Massachusetts yelp,https://www.yelp.com/biz/greek-corner-restaurant-cambridge
Hightstown Diner Hightstown New Jersey yelp,https://www.yelp.com/biz/hightstown-diner-hightstown
Stockyards Smokehouse and Larder Toronto Ontario Canada yelp,https://www.tripadvisor.com/Restaurant_Review-g155019-d1544953-Reviews-The_Stockyards_Smokehouse_Larder-Toronto_Ontario.html
Sammy\xe4\xf3\xbbs Food Service & Deli New Orleans Louisiana yelp,No URL Found
Big Star Diner Bainbridge Island Washington yelp,https://www.yelp.com/biz/the-madison-diner-bainbridge-island
Super Duper Weenie Fairfield Connecticut yelp,https://www.yelp.com/biz/super-duper-weenie-fairfield
Athens Family Restaurant Nashville Tennessee yelp,https://www.yelp.com/biz/athens-family-restaurant-nashville
The Latin House Miami Florida yelp,https://www.yelp.com/biz/latin-house-grill-miami-3
Bro\xe4\xf3\xbbs Cajun Cuisine Nashville Tennessee yelp,No URL Found
Don Chow Tacos Los Angeles California yelp,https://www.yelp.com/biz/don-chow-tacos-los-angeles
Smoque Chicago Illinois yelp,https://www.yelp.com/biz/smoque-bbq-chicago
The Lobster Shanty Salem Massachusetts yelp,https://www.yelp.com/biz/the-lobster-shanty-salem
Skylark Diner Edison New Jersey yelp,https://www.yelp.com/biz/skylark-diner-edison
Johnny\xe4\xf3\xbbs Bar-B-Q Mission Kansas yelp,No URL Found
The Tamale Place Indianapolis Indiana yelp,https://www.yelp.com/biz/the-tamale-place-indianapolis
Pizza Palace Knoxville Tennessee yelp,https://www.yelp.com/biz/pizza-palace-knoxville
Texas Pride BBQ Adkins Texas yelp,https://www.yelp.com/biz/texas-pride-barbecue-adkins
55 South Franklin Tennessee yelp,https://www.yelp.com/biz/55-south-franklin
Golden Crown Panaderia Albuquerque New Mexico yelp,https://www.yelp.com/biz/golden-crown-panaderia-albuquerque
Tecolote Caf\xed\xa9 Santa Fe New Mexico yelp,https://www.yelp.com/biz/tecolote-cafe-santa-fe-3
Jamaica Gates Caribbean Cuisine Arlington Texas yelp,https://www.yelp.com/biz/jamaica-gates-caribbean-cuisine-arlington
Fuel Cantina Charleston South Carolina yelp,https://www.yelp.com/biz/fuel-charleston-2
Thee Pitts Again Silverton Colorado yelp,https://www.yelp.com/biz/thee-pitts-again-silverton
Miller's East Coast Deli San Francisco California yelp,https://www.yelp.com/biz/millers-east-coast-deli-san-francisco
Roberto's Mexican Food Phoenix Arizona yelp,https://www.yelp.com/biz/robertos-mexican-food-phoenix-2
Pretzel Cart Ferndale California yelp,https://www.yelp.com/biz/disneylands-pretzel-cart-anaheim
Joe Squared Pizza Baltimore Maryland yelp,https://www.yelp.com/biz/joe-squared-pizza-baltimore
Michigan Brewing Co. Webberville Michigan yelp,https://www.yelp.com/biz/michigan-brewing-company-webberville
Flakowitz of Boynton Boynton Beach Florida yelp,https://www.yelp.com/biz/flakowitz-of-boynton-boynton-beach
Picabu Neighborhood Bistro Spokane Washington yelp,https://www.yelp.com/biz/picabu-neighborhood-bistro-spokane
Lake Effect Diner Buffalo New York yelp,https://www.yelp.com/biz/lake-effect-diner-buffalo-2
Blackthorn Restaurant & Pub Buffalo New York yelp,https://www.yelp.com/biz/blackthorn-restaurant-and-pub-buffalo
Jamaicaway Nashville Tennessee yelp,https://www.yelp.com/biz/jamaicaway-restaurant-and-catering-nashville-2
Geechee Girl Rice Cafe Philadelphia Pennsylvania yelp,https://www.yelp.com/biz/geechee-girl-rice-cafe-philadelphia
Island Frydays Cincinnati Ohio yelp,https://www.yelp.com/biz/island-frydays-cincinnati
R&R Taqueria Elkridge Maryland yelp,https://www.yelp.com/biz/r-and-r-taqueria-elkridge-2
Smokey Valley Truck Stop Olive Hill Kentucky yelp,https://www.yelp.com/biz/smokey-valley-truck-stop-olive-hill
Captain Chuck A Mucks Rescue Virginia yelp,http://www.captainchuck-a-mucks.com/
Black Duck Caf\xed\xa9 Westport Connecticut yelp,No URL Found
Osaka Japanese Bistro Las Vegas Nevada yelp,https://www.yelp.com/biz/osaka-japanese-bistro-las-vegas
